{
  "schema_version": "yonerai.status.healthcheck.v1",
  "generated_at": "2026-06-18T00:00:00+09:00",
  "locale_default": "ja",
  "range": {
    "start": "2026-06-18",
    "days": 90
  },
  "states": {
    "operational": {
      "color": "#26c6a3",
      "label": {
        "ja": "稼働中",
        "en": "Operational"
      }
    },
    "degraded": {
      "color": "#ffbf2f",
      "label": {
        "ja": "性能低下",
        "en": "Degraded"
      }
    },
    "maintenance": {
      "color": "#ff8a34",
      "label": {
        "ja": "メンテナンス",
        "en": "Maintenance"
      }
    },
    "major_outage": {
      "color": "#ef4e45",
      "label": {
        "ja": "重大障害",
        "en": "Major outage"
      }
    },
    "not_started": {
      "color": "#aeb6c2",
      "label": {
        "ja": "準備中",
        "en": "Not started"
      }
    }
  },
  "categories": [
    {
      "id": "infrastructure",
      "name": {
        "ja": "インフラ",
        "en": "Infrastructure"
      },
      "components": [
        {
          "id": "aws-staging",
          "name": {
            "ja": "AWS staging",
            "en": "AWS staging"
          },
          "fact": {
            "ja": "CloudWatch 指標を集約して監視します。",
            "en": "Monitor via aggregated CloudWatch metrics."
          },
          "monitoring": {
            "ja": "aws_metric",
            "en": "aws_metric"
          },
          "claim": {
            "ja": "本番運用の可用性は実運用接続時のみ主張します。",
            "en": "Production operation claim is only valid once live checks are connected."
          },
          "default_state": "not_started",
          "checks": [
            {
              "type": "aws_metric",
              "namespace": "AWS/Lambda",
              "metric_name": "Errors",
              "period_seconds": 300,
              "statistic": "Sum",
              "value": 0,
              "comparison": "<=",
              "threshold": 0,
              "degraded_threshold": 1,
              "major_threshold": 5,
              "label": "lambda-errors",
              "message": {
                "ja": "Lambda Errors が 0 であることを期待します。",
                "en": "Expect Lambda Errors to stay at 0."
              }
            },
            {
              "type": "aws_metric",
              "namespace": "AWS/Lambda",
              "metric_name": "ConcurrentExecutions",
              "period_seconds": 300,
              "statistic": "Maximum",
              "value": 0,
              "comparison": "<=",
              "threshold": 100,
              "degraded_threshold": 250,
              "major_threshold": 500,
              "label": "lambda-concurrency",
              "message": {
                "ja": "同時実行数の異常上昇を監視します。",
                "en": "Monitor Lambda concurrent execution spikes."
              }
            }
          ]
        },
        {
          "id": "aws-rds",
          "name": {
            "ja": "AWS RDS",
            "en": "AWS RDS"
          },
          "fact": {
            "ja": "RDS 接続や可用性指標を反映します。",
            "en": "Reflect database availability and latency signals."
          },
          "monitoring": {
            "ja": "aws_metric",
            "en": "aws_metric"
          },
          "claim": {
            "ja": "本番運用の可用性は実運用接続時のみ主張します。",
            "en": "Production operation claim is only valid once live checks are connected."
          },
          "default_state": "not_started",
          "checks": [
            {
              "type": "aws_metric",
              "namespace": "AWS/RDS",
              "metric_name": "DatabaseConnections",
              "period_seconds": 300,
              "statistic": "Average",
              "value": 0,
              "comparison": "<=",
              "threshold": 200,
              "degraded_threshold": 300,
              "major_threshold": 500,
              "label": "rds-connections",
              "message": {
                "ja": "RDS 接続数を監視します。",
                "en": "Monitor RDS connection count."
              }
            }
          ]
        }
      ]
    }
  ]
}
